{
  "schema_version": "adaptive_creator_loop.product_runtime_review_packet.v1",
  "review_id": "product-runtime-open-review-2026-05-04",
  "requested_release": "network_absorption",
  "network_absorbable": false,
  "product_runtime_controls_wired": false,
  "surfaces": {
    "builder": {
      "status": "missing",
      "reviewer": null,
      "evidence_ref": null,
      "runtime_wiring_reviewed": false,
      "read_only_adapter_preserved": false,
      "blocked_states_visible": false,
      "evidence_mode_preserved": false,
      "creator_controls_enabled": false,
      "network_publication_allowed": false,
      "rollback_plan_ref": null
    },
    "telegram": {
      "status": "missing",
      "reviewer": null,
      "evidence_ref": null,
      "runtime_wiring_reviewed": false,
      "read_only_adapter_preserved": false,
      "blocked_states_visible": false,
      "evidence_mode_preserved": false,
      "creator_controls_enabled": false,
      "network_publication_allowed": false,
      "rollback_plan_ref": null
    },
    "spawner": {
      "status": "missing",
      "reviewer": null,
      "evidence_ref": null,
      "runtime_wiring_reviewed": false,
      "read_only_adapter_preserved": false,
      "blocked_states_visible": false,
      "evidence_mode_preserved": false,
      "creator_controls_enabled": false,
      "network_publication_allowed": false,
      "rollback_plan_ref": null
    },
    "canvas": {
      "status": "missing",
      "reviewer": null,
      "evidence_ref": null,
      "runtime_wiring_reviewed": false,
      "read_only_adapter_preserved": false,
      "blocked_states_visible": false,
      "evidence_mode_preserved": false,
      "creator_controls_enabled": false,
      "network_publication_allowed": false,
      "rollback_plan_ref": null
    },
    "kanban": {
      "status": "missing",
      "reviewer": null,
      "evidence_ref": null,
      "runtime_wiring_reviewed": false,
      "read_only_adapter_preserved": false,
      "blocked_states_visible": false,
      "evidence_mode_preserved": false,
      "creator_controls_enabled": false,
      "network_publication_allowed": false,
      "rollback_plan_ref": null
    }
  },
  "claim_boundary": "Product runtime review evidence is required before exposing creator controls, but this packet does not wire product surfaces or approve network_absorbable.",
  "next_actions": [
    "Review Builder, Telegram, Spawner, Canvas, and Kanban runtime branches separately.",
    "Keep creator controls disabled until every surface has rollback and blocked-state evidence."
  ]
}
