{
  "schema_version": "adaptive_creator_loop.product_runtime_review_packet.v1",
  "review_id": "product-runtime-read-only-review-2026-05-04",
  "requested_release": "network_absorption",
  "network_absorbable": false,
  "product_runtime_controls_wired": false,
  "surfaces": {
    "builder": {
      "status": "passed",
      "reviewer": "creator-system-release-review",
      "evidence_ref": "docs/creator_system/PRODUCT_SURFACE_CONSUMER_BRANCHES_2026-05-01.md#builder",
      "runtime_wiring_reviewed": true,
      "read_only_adapter_preserved": true,
      "blocked_states_visible": true,
      "evidence_mode_preserved": true,
      "creator_controls_enabled": false,
      "network_publication_allowed": true,
      "rollback_plan_ref": "docs/creator_system/PHASE_2_PRODUCT_FLOW_BACKLOG.md#rollback-and-publication-boundary"
    },
    "telegram": {
      "status": "passed",
      "reviewer": "creator-system-release-review",
      "evidence_ref": "docs/creator_system/PRODUCT_SURFACE_CONSUMER_BRANCHES_2026-05-01.md#telegram",
      "runtime_wiring_reviewed": true,
      "read_only_adapter_preserved": true,
      "blocked_states_visible": true,
      "evidence_mode_preserved": true,
      "creator_controls_enabled": false,
      "network_publication_allowed": true,
      "rollback_plan_ref": "docs/creator_system/PHASE_2_PRODUCT_FLOW_BACKLOG.md#rollback-and-publication-boundary"
    },
    "spawner": {
      "status": "passed",
      "reviewer": "creator-system-release-review",
      "evidence_ref": "docs/creator_system/PRODUCT_SURFACE_CONSUMER_BRANCHES_2026-05-01.md#spawner",
      "runtime_wiring_reviewed": true,
      "read_only_adapter_preserved": true,
      "blocked_states_visible": true,
      "evidence_mode_preserved": true,
      "creator_controls_enabled": false,
      "network_publication_allowed": true,
      "rollback_plan_ref": "docs/creator_system/PHASE_2_PRODUCT_FLOW_BACKLOG.md#rollback-and-publication-boundary"
    },
    "canvas": {
      "status": "passed",
      "reviewer": "creator-system-release-review",
      "evidence_ref": "docs/creator_system/PRODUCT_SURFACE_CONSUMER_BRANCHES_2026-05-01.md#canvas",
      "runtime_wiring_reviewed": true,
      "read_only_adapter_preserved": true,
      "blocked_states_visible": true,
      "evidence_mode_preserved": true,
      "creator_controls_enabled": false,
      "network_publication_allowed": true,
      "rollback_plan_ref": "docs/creator_system/PHASE_2_PRODUCT_FLOW_BACKLOG.md#rollback-and-publication-boundary"
    },
    "kanban": {
      "status": "passed",
      "reviewer": "creator-system-release-review",
      "evidence_ref": "docs/creator_system/PRODUCT_SURFACE_CONSUMER_BRANCHES_2026-05-01.md#kanban",
      "runtime_wiring_reviewed": true,
      "read_only_adapter_preserved": true,
      "blocked_states_visible": true,
      "evidence_mode_preserved": true,
      "creator_controls_enabled": false,
      "network_publication_allowed": true,
      "rollback_plan_ref": "docs/creator_system/PHASE_2_PRODUCT_FLOW_BACKLOG.md#rollback-and-publication-boundary"
    }
  },
  "claim_boundary": "Product runtime review evidence is required before exposing creator controls, but this packet does not wire product surfaces or approve network_absorbable.",
  "next_actions": [
    "Attach this packet to creator-release-gate only as product runtime review evidence.",
    "Keep product creator controls disabled until product-repo runtime reviews explicitly approve them."
  ]
}
